,,"From Remotive.com 
with ♥",,,,,https://remotive.com/join,💼 🏠🤗💻,,   ,,,,,,,,,,,
Legacy,Old,Pipedrive,pipedrive,twitter.com/,,501-1000,Sales pipeline software that gets you organized. ,https://www.pipedrive.com/,"New York, NY",USA,"Sergei Anikin/Michael Schrezenmaier
",timorein,twitter.com/,https://www.pipedrive.com/en/jobs,,,,,,,
,New,Pitch,,,,51-200,An open platform for presentations and content collaboration,https://pitch.com/,Berlin,Germany,Christian Reber,,,,,,,,,,
Legacy,Old,Pixel2HTML,pixel2html,twitter.com/,,11-50,Front-End Development Company,https://pixel2html.com,"Wilmington, Delaware",USA,Bruno Belcastro,,,http://pixel2html.com/jobs.html,,,,,,,
,New,PixelHaus Media,,,,1-10,Advertising and growth agency helping brands achieve sky-high ROI.,https://pixelhaus.io/,Amsterdam,The Netherlands,Mirella Crespi,,,,,,,,,,
,New,Pixels for Humans,,,,1-10,Work with SaaS startups to create intentional businesses that care,https://www.pixelsforhumans.com/,"Boston, MA",USA,Heather O'Neill ,,,,,,,,,,
Legacy,Old,Platform.sh,platformsh,twitter.com/,,201-500,CONTINUOUS DEPLOYMENT CLOUD HOSTING,https://platform.sh/,Paris,France,Fred Plais,fredplais,twitter.com/,https://platform.sh/company/jobs/,,,,,,,
Legacy,Old,Plex,plex,twitter.com/,,51-200,Your media on all your devices,https://www.plex.tv/,"Los Gatos, CA",USA,Keith Valory,jason_blessing,twitter.com/,https://www.plex.tv/about/careers/,,,,,,,
,,Podia,,,,1-10,"Sell memberships, online courses, and digital downloads to your audience",podia.com,"New York, NY",USA,Spencer Fry,,,,,,,,,,
,New,Pond5,,,,51-200,Help filmmakers fulfill their creative vision.,http://www.pond5.com/,"New York, NY",USA,Tom Crary ,,,,,,,,,,
Legacy,Old,Postlight,postlightstudio,twitter.com/,,51-200,Builds and designs apps for web and mobile.,https://postlight.com/?,"New York, NY",USA,Paul Ford,ftrain,twitter.com/,https://postlight.recruiterbox.com/,,,,,,,
,New,Postmark,,,,11-50,"Delivers your transactional email to customers on time, every time.",https://postmarkapp.com/,"Philadelphia, PA",USA,,,,,,,,,,,
,New,Power Diary,,,,11-50,Provide health practitioners with the ultimate Practice Management Software,https://www.powerdiary.com/,"Ballarat Central, Victoria",Australia,Damien & Paul Adler,,,,,,,,,,
Legacy,Old,Precision Nutrition,insidePN,twitter.com/,,51-200,Online nutrition and fitness coaching,http://www.precisionnutrition.com/,Toronto ,Canada,Timothy Joel Jones,philcaravaggio,twitter.com/,http://www.precisionnutrition.com/careers,,,,,,,
WWR,Old,Pressable,pressable,twitter.com/,,51-200,Where WordPress Works Best,pressable.com,"San Antonio, TX",USA,Alex Kombos,,,https://pressable.com/careers/,,,,,,,
Lukasz,Old,PreviousNext,previousnext,twitter.com/,,11-50,Australian based Drupal agency.,https://www.previousnext.com.au/about/careers,"Avalon, NSW",Australia,,,,https://www.previousnext.com.au/about/careers,,,,,,,
StackO Jobs,Old,Prezly,Prezly,twitter.com/,,11-50,Connect your content with your influencers.,https://www.prezly.com/careers,Leuven,Belgium,Gijs Nelissen,,,https://www.prezly.com/careers,,,,,,,
Legacy,Old,Product Hunt,ProductHunt,twitter.com/,,11-50,"A curation of the best new products, every day",http://producthunt.com/,"San Francisco, CA",USA,Ryan Hoover,rrhoover,twitter.com/,https://www.producthunt.com/jobs,,,,,,,
WWR,Old,Productive Power,N/A,twitter.com/,,1-10,Help professionals master their digital lives so they can achieve their greatest potential.,http://productivepower.applytojob.com/,"Miami, FL",USA,Brett Spodak,,,http://productivepower.applytojob.com,,,,,,,
remoteok,Old,Proemion,Proemion,twitter.com/,,51-200,Telematics Solutions for industrial applications,https://career.proemion.com/en/jobs.html,,Germany,Robert Michaelides,,,https://www.proemion.com/,,,,,,,
,New,ProFinda,,,,11-50,"Maps the skills, knowledge and expertise available across an organisation's talent",https://www.profinda.com/,London,UK,Roger Gorman,,,,,,,,,,
Legacy,Old,Protocol Labs,protocollabs,twitter.com/,,51-200,Develops IPFS and Filecoin.,http://ipn.io/,"Palo Alto, CA",USA,Juan Benet,juanbenet,twitter.com/,https://angel.co/protocol-labs/jobs,,,,,,,
,New,PSPDFKit,,,,11-50,The Best Way to Handle PDF Documents on any platform.,https://pspdfkit.com/,Vienna,Austria,Peter Steinberger,,,,,,,,,,
,New,Punchpass,,,,1-10,Help small fitness studios manage their customers,https://punchpass.com/,Vermont,USA,Chris Patton,,,,,,,,,,
Legacy,Old,Puppet Labs,puppetize,twitter.com/,,501-1000,Puppet Labs is an information technology automation software company,https://puppet.com/,"Portland, OR",USA,"Yvonne Wassenaar
",mirchi111,twitter.com/,https://puppet.com/company/careers,,,,,,,
,New,Qikker Online,,,,11-50,Qikker Online is a fast-growing digital agency,https://www.qikkeronline.nl/,Amsterdam,The Netherlands,Michiel Willekens ,,,,,,,,,,
WWR,Old,Quartzy,Quartzy,twitter.com/,,51-200,Helping scientists discover the future,https://www.quartzy.com/about,"Hayward, CA",USA,Jayant Kulkarni,,,https://www.quartzy.com/careers,,,,,,,
WWR,Old,Rackspace Technology,Rackspace,twitter.com/,,"5,001-10,000 ",Public Cloud Infrastructure ,https://rackspace.jobs/,"San Antonio, TX",USA,Kevin M. Jones,,,https://rackspace.jobs/,,,,,,,
remoteok,Old,Railroad19,N/A,twitter.com/,,11-50,Custom Software And Cloud Platform Needs.,https://www.railroad19.com/#careers,"Saratoga Springs, NY",USA,John Luttmer,,,https://www.railroad19.com/#careers,,,,,,,
Legacy,Old,Railsformers,railsformers,twitter.com/,,11-50,We have been programming with Ruby on Rails,https://railsformers.com/,Ostrava,Czech Republic,Jiri Kubica,jirikubica,twitter.com/,https://angel.co/railsformers,,,,,,,
Legacy,Old,RainforestQA,rainforestqa,twitter.com/,,11-50,Quality Assurance as a Service,https://www.rainforestqa.com/,"San Francisco, CA",USA,Fred Stevens-Smith,fredsters_s,twitter.com/,https://www.rainforestqa.com/jobs/,,,,,,,
,Old,Raising the floor,,,,11-50,Evolving the GPII to make IT access simpler and more affordable for everyone,https://raisingthefloor.org/,Geneva,Switzerland,,,,,,,,,,,
Legacy,Old,RaRe Technologies,raretechteam,twitter.com/,,1-10,Where cutting edge data science meets robust engineering.,https://rare-technologies.com/,Brno,Czech Republic,Radim Řehůřek,RadimRehurek,twitter.com/,https://rare-technologies.com/careers/,,,,,,,
WWR,Old,ReCharge,RechargePayment,twitter.com/,,201-500,empower stores by making payments easy for everyone.,https://rechargepayments.com/about,"Santa Monica, CA",USA,Oisin O'Connor,,,https://rechargepayments.com/about,,,,,,,
,New,RecognizeApp,,,,2-10,"Helping companies communicate company values, while retaining top employees.",https://recognizeapp.com/,"Oakland, CA",USA,Alex Grande,,,,,,,,,,
Legacy,Old,Recruiterbox,recruiterbox,twitter.com/,,51-200,Recruitment software,http://recruiterbox.com/,"Seattle, WA ",USA,Julie Rieken,whoisraj,twitter.com/,http://recruiterbox.com/company/about-us/#careers,,,,,,,
Lukasz,Old,Recurly,recurly,twitter.com/,,201-500,Recurring billing management for subscription-based businesses,https://recurly.com/,"San Francisco, CA ",USA,Dan Burkhart,,,https://angel.co/recurly,,,,,,,
,Old,Red Guava,,,,11-50,"Smart people, Simple software",http://www.redguava.com.au/,"Melbourne, VIC",Australia,Liora & Joel,,,,,,,,,,
Legacy,Old,Red Hat,RedHatNews,twitter.com/,,"10,001+",Open source software company,https://www.redhat.com,"Raleigh, North Carolina",USA,Paul Cormier,JWhitehurst,twitter.com/,https://www.redhat.com/en/jobs,,,,,,,
remoteok,Old,Redox,Redox,twitter.com/,,51-200,Redox is the modern API for healthcare,https://www.redoxengine.com/careers,"Madison, WI",USA,Luke Bonney,,,https://www.redoxengine.com/careers,,,,,,,
Legacy,Old,Reinteractive,reinteractive,twitter.com/,,11-50,Confident software with Ruby on Rails and JavaScript,https://reinteractive.com/,Sydney,Australia,Mikel Lindsaar,lindsaar,twitter.com/,,,,,,,,
Legacy,Old,Relayto,relayter,twitter.com/,,11-50,Interactive & measurable document experience,https://relayto.com/,"San Mateo, California",USA,Alex Shevelenko ,shevelenko,twitter.com/,https://relayto.com/careers,,,,,,,
,Old,RemoteYear,,,,11-50,A foundation for professionals to work & explore the world as part of a vibrant global community. ,remoteyear.com,,USA,"Shaun Prime
 ",,,,,,,,,,
,Old,Restorepoint,,,,11-50,"Disaster Recovery, Automation and Compliance for Networks",http://www.restorepoint.com,"Woking, Surrey",UK,Riccardo Valente,,,,,,,,,,
remoteok,Old,retail-zipline,retailzipline,twitter.com/,,51-200,"Built by Retail, for Retailers",https://retailzipline.com/about.html,"San Francisco, Ca",USA,Melissa Wong,,,https://retailzipline.com/about.html,,,,,,,
Legacy,Old,RetailNext,RetailNext,twitter.com/,,201-500,Analytics for physical retail stores.,http://retailnext.net/en/home/,"San Jose, CA",USA,Alexei Agratchev,agratchev,twitter.com/,http://retailnext.net/en/about-us/career-openings/,,,,,,,
,New,Retrospect,,,,11-50,Retrospect develops backup software for small businesses,http://www.retrospect.com/,"Wallnut Creek, CA",USA,JG Heithcock,,,,,,,,,,
Cty,Old,Roadtrippers,roadtrippers,twitter.com/,,51-200,"Travelers can seamlessly discover, plan & book their next trip, all in one place",http://jobs.roadtrippers.com/apply/,"Cincinnati, OH",USA,James Fisher,,,http://jobs.roadtrippers.com/apply/,,,,,,,
,New,Rocketrip,,,,51-200,Rocketrip helps enterprise companies reduce travel costs ,https://www.rocketrip.com/,"New York, NY",USA,Dan Ruch,,,,,,,,,,
,Old,Run the World Digital,,,,11-50,Progressive political and non-profit digital fundraising firm,https://www.runtheworlddigital.com/,"Madison, WI",USA,Heather Colburn,,,,,,,,,,
Legacy,Old,Salesforce,salesforce,twitter.com/,,"10,001+",CRM SaaS,https://www.salesforce.com/fr/?ir=1,"San Francisco, CA",USA,Marc Benioff,Benioff,twitter.com/,www.salesforce.com/company/careers/,,,,,,,
,Old,SalesHoo,,,,11-50,Online selling directory ,https://www.salehoo.com,Chistchurch,New Zealand,Simon Slade,,,,,,,,,,
,New,Salesmsg,,,,11-50,"Simple, scalable, two-way business texting.",https://www.salesmessage.com/,"Delray Beach, FL",USA,Chris Brisson,,,,,,,,,,
remoteok,Old,Sapien,sapien_network,twitter.com/,,11-50,"A highly customizable, democratized social news platform ",https://www.sapien.network/,"Berkeley, CA",USA,Ankit Bhatia,,,https://www.sapien.network/,,,,,,,
,,Savvy Navvy,,,,1-10,"The ""Google Maps"" for sailors...",https://www.savvy-navvy.com,London,UK,Jelte Liebrand,,,,,,,,,,
Legacy,Old,ScienceLogic,ScienceLogic,twitter.com/,,201-500,Hybrid IT Monitoring,https://www.sciencelogic.com/,"Reston, Virginia",USA,Dave Link,dave_f_link,twitter.com/,https://www.sciencelogic.com/company/careers,,,,,,,
Legacy,Old,Screenly,screenlyapp,twitter.com/,,11-50,Digital Signage powered by Raspberry Pis,https://www.screenly.io/,London,UK,Viktor Petersson,vpetersson,twitter.com/,https://remotebase.io/company/screenly/jobs,,,,,,,
Legacy,Old,Security Roots,securityroots,twitter.com/,,1-10,Collaboration tools for IT Security teams.,http://securityroots.com,London,UK,Daniel Martin,etdsoft,twitter.com/,http://securityroots.com/careers.html,,,,,,,
,Old,Seeq,,,,51-200,Advanced analytics for process manufacturing data,http://seeq.com/,Seattle,USA,Steve Sliwa,,,,,,,,,,
,Old,Seez,,,,11-50,Seez R searches the entire car market from one place. ,http://seez.co,Dubai,United Arab Emirates,Tarek Kabrit,,,,,,,,,,
remoteok,Old,Semaphore CI,semaphoreci,twitter.com/,,11-50,platform that makes development teams move faster,https://semaphoreci.com/about/careers,Novi Sad,Serbia,Darko Fabijan,,,,,,,,,,
Legacy,Old,Sencha Inc,sencha,twitter.com/,,51-200,Enterprise Javascript Frameworks,https://www.sencha.com/,"Austin, TX",USA,,,,https://www.sencha.com/company/careers/,,,,,,,
,New,Sendible,,,,11-50,Make managing social media easier for marketing teams ,https://www.sendible.com/,London,UK,Gavin Hammar,,,,,,,,,,
,,SerpApi,,,,11-50,Real-time search engine scraping API,https://serpapi.com/,"Austin, TX",USA,Julien Khaleghy,,,,,,,,,,
Lukasz,Old,ServiceNow,servicenow,twitter.com/,,10000+,Enterprise cloud computing,https://www.servicenow.com/,"Santa Clara, CA",USA,"Bill McDermott
",,,https://www.servicenow.com/company/executive-team.html,,,,,,,
,New,SevenAtoms,,,,11-50,The leading digital marketing growth engine for our customers,https://www.sevenatoms.com/,"San Francisco, CA",USA,Andy Beohar,,,,,,,,,,
Legacy,Old,ShakaCode,shakacode,twitter.com/,,11-50,"We build custom web & mobile applications, with Rails, React, and Swift.",http://www.shakacode.com/,"Hawaii, HI",USA,Justin Gordon,,,http://www.shakacode.com/about/,,,,,,,
StackO Jobs,Old,Sherpany AG,sherpany,twitter.com/,,51-200,Insights on #Boards #digital transformation & #BoardMembers practices,https://www.sherpany.com/en/careers/,Zurich,Switzerland,Tobias Häckermann,,,https://www.sherpany.com/,,,,,,,
,,Shield GEO,,,,11-50,International Employment Made Simple,https://shieldgeo.com/,London,UK,Duncan Macintosh/Tim Burgess,,,,,,,,,,
,New,shiftling,,,,1-10,Change the way work is done in MENA,https://www.shiftling.com/,,,,,,,,,,,,,
Legacy,Old,Shopify,Shopify,twitter.com/,,5001-10000,An e-commerce platform,https://www.shopify.com,"Ottawa, Toronto",Canada,Tobias Lütke,tobi,twitter.com/,https://www.shopify.com/careers,,,,,,,
Legacy,Old,Shortfundly,shortfundly,twitter.com/,,11-50,Connecting platform for short film filmmakers,https://www.shortfundly.com/,Chennai,India,Selvam M,,,https://angel.co/shortfundly/jobs,,,,,,,
Legacy,Old,Simbiose Ventures,N/A,twitter.com/,,11-50,"We are a startup studio, a company that creat",http://www.simbioseventures.com/,Ṣao Paulo,Brazil,Gabriel Menegatti,GaMenegatti,twitter.com/,https://remoteok.io/remote-startups/simbiose-ventures,,,,,,,
WWR,Old,Simplecast,Simplecast,twitter.com/,,11-50,The easiest way for podcasters to publish and distribute audio on the internet.,https://simplecast.com/,"Troy, NY",USA,Brad Smith,,,https://simplecast.com/,,,,,,,
WWR,Old,SiteGround,SiteGround,twitter.com/,,501-1000,Webhosting crafted with care,https://www.siteground.com/careers,Sofia,Bulgaria,Tenko Nikolov,,,https://www.siteground.com/careers,,,,,,,
,New,Sitemate Technologies ,,,,11-50,"Document assembly, automation and analytics - built for the industries.",https://sitemate.com/,"Sydney, NSW",Australia,Hartley Pike,,,,,,,,,,
,Old,Sked Social,,,,11-50,Social media scheduling and publishing,skedsocial.com/,"Melbourne, VI",USA,Hugh Stephens,,,,,,,,,,
,New,Sketch,,,,51-200,Award-winning Mac application for designers,https://www.sketch.com,The Hague,Netherlands,Pieter Omvlee,,,,,,,,,,
Legacy,Old,SketchTogether.com,sketchtogether,twitter.com/,,11-50,The whiteboard that matches how we work today,https://sketchtogether.com,,USA,Nicolas Mangano ,nfmangano,twitter.com/,,,,,,,,
Legacy,Old,Skillshare,skillshare,twitter.com/,,51-200,Skillshare is a learning community for creators.,https://www.skillshare.com/,"New York, NY",USA,Matt Cooper ,mikekarnj,twitter.com/,https://www.skillshare.com/careers,,,,,,,
Legacy,Old,Skore,SkoreHQ,twitter.com/,,11-50,Collaborative knowledge management,http://www.skore.io/,Sao Paulo,Brazil,Luis Novo,lfnovo,twitter.com/,http://careers.skore.io/,,,,,,,
remoteok,Old,Skycrapers,N/A,twitter.com/,,1-10,Applied cloud and devops solutions,https://skyscrapers.eu/team,Hoevenen,Belgium,Frederik Denkens,,,https://skyscrapers.eu/jobs/lead-engineer,,,,,,,
,New,Slite,,,,11-50,Create your company wiki. Collaborate on projects. Take meeting notes.,https://slite.com,Paris,France,Christophe Pasquier,,,,,,,,,,
,New,Small Improvements,,,,11-50,We help employees grow and succeed,https://www.small-improvements.com/,Berlin,Germany,Per Fragemann,,,,,,,,,,
WWR,Old,SmileDirectClub,smiledirectclub,twitter.com/,,5001-10000,Smiles Are Forever,https://smiledirectclub.com/about/,"Nashville, TN",USA,David Katzman,,,http://smiledirectclub.applicantstack.com,,,,,,,
,New,SMTP2GO,,,,11-50,Email delivery done right,https://www.smtp2go.com/,Christchurch,New Zealand,Charlie Abrahamson,,,,,,,,,,
,New,Social Chorus,,,,51-200,Workforce communications platform that transforms how workers & organizations connect,https://www.socialchorus.com/,"San Francisco, CA",USA,Gary Nakamura,,,,,,,,,,
Legacy,Old,Sococo,sococo,twitter.com/,,11-50,Revolutionizing online business communication.,https://www.sococo.com,"Boston, MA",USA,Charlotte Hill,cliffpollan,twitter.com/,www.indeed.com/cmp/Sococo,,,,,,,
Legacy,Old,SoftwareMill,softwaremill,twitter.com/,,51-200,Custom software by true engineers,https://softwaremill.com/,Poland,Poland,Adam Warski,adamwarski,twitter.com/,https://softwaremill.com/join-us/,,,,,,,
,New,Sonatype,,,,201-500,Automate Open Source Security.,https://www.sonatype.com/,"Fulton, MD",USA,Wayne Jackson,,,,,,,,,,
,New,Sopris Health,,,,2-10,Intelligent Clinical Operations,https://www.soprishealth.com/,"Denver, CO",USA,Patrick Leonard,,,,,,,,,,
,New,Soshace,,,,11-50,Professional developers you can trust,https://soshace.com/,St Petersburg,Russia,Nikita Bragin,,,,,,,,,,
WWR,Old,Sourcefabric,sourcefabric,twitter.com/,,51-200,Open Source Tools for Journalism,https://www.sourcefabric.org/,Prague,Czech Republic,Sava Tatić,,,https://www.sourcefabric.org/,,,,,,,
Legacy,Old,SparkLabs,sparklabs,twitter.com/,,1-10,Creating powerful desktop and mobile apps.,https://www.sparklabs.com,Bathurst,Australia,James Bekkema,jbekkema,twitter.com/,https://angel.co/jobs?slug=sparklabs,,,,,,,
Legacy,Old,Speedchecker,internetspeed,twitter.com/,,11-50,Internet performance monitoring,http://www.speedchecker.xyz/,Dublin,Ireland,Janusz Jezowicz,,,,,,,,,,
Legacy,Old,Spotify,Spotify,twitter.com/,,"5,001-10,000",Music for everyone,https://www.spotify.com/,Stockholm,Sweden,Daniel Ek,eldsjal,twitter.com/,https://www.spotify.com/fr/jobs/,,,,,,,
Legacy,Old,Spreaker,spreaker,twitter.com/,,11-50,Podcasting platform,http://www.spreaker.com/,"New York, NY",USA,Francesco Baschieri,thebask,twitter.com/,http://www.spreaker.com/jobs,,,,,,,
,New,Squash Labs,,,,11-50,Our automated testing service allows developers to spend more time innovating,https://squash.io/,"Vancouver, BC",Canada,Evandro Miquelito,,,,,,,,,,
Legacy,Old,Stack Exchange,stackexchange,twitter.com/,,1-10,Community-driven question and answer sites,http://stackexchange.com/,"New York, NY",USA,Joel Spolsky,spolsky,twitter.com/,http://stackoverflow.com/company/work-here,,,,,,,
Legacy,Old,Stack Overflow,stackoverflow,twitter.com/,,51-200,We help millions of people find expert answers and amazing jobs every day.,http://stackoverflow.com/,"New York, NY",USA,Joel Spolsky,spolsky,twitter.com/,http://stackoverflow.com/company/work-here,,,,,,,
Legacy,Old,Staff Squared,staffsquared,twitter.com/,,11-50,"Finally, somebody made great HR software for small and medium businesses",http://www.staffsquared.com/,Essex,England,Simon Swords,simonswords,twitter.com/,,,,,,,,
Legacy,Old,Starcoders,starcoders_com,twitter.com/,,11-50,Web development company.,https://starcoders.com/,Ghent,Belgium,,joelcraenhals,twitter.com/,https://starcoders.com/#/,,,,,,,
Legacy,Old,Statement,statement,twitter.com/,,11-50,We help companies grow in a digital world,https://www.statementagency.com/,Leeds,UK,Dan Conboy,,,,,,,,,,
,New,StayWell,,,,501-1000,Improving health,https://www.staywell.com/,"Yardley, PA",USA,"Patrick Clifford
",,,,,,,,,,
Legacy,Old,SteepRock,steeprockinc,twitter.com/,,201-500,Life science relationship management.,http://www.steeprockinc.com/,"Westport, CT",USA,"Hank Taylor
      ",,,,,,,,,,
,,Sticker Mule,,,,51-200,Create custom stickers that kick ass,https://www.stickermule.com/,"Boulder, CO",USA,Anthony Constantino,,,,,,,,,,
,New,Sticky,,,,1-10,Helping Photographers Be Better Marketers,https://stickymarketingtools.com,MN,USA,Nate Grahek,,,,,,,,,,
,New,Strategyzer,,,,51-200,Business Model Canvas,https://strategyzer.com/,Toronto,Canada,Alex Osterwalder,,,,,,,,,,
Legacy,Old,Stripe,stripe,twitter.com/,,1000-5000,Stripe is the best way to accept payments,https://stripe.com,"San Francisco, CA",USA,Patrick Collison,patrickc,twitter.com/,https://stripe.com/jobs,,,,,,,
,,strongDM,,,,51-200,Secure infrastructure access for the modern stack.,https://www.strongdm.com/,"Burlingame, CA",USA,Tim Prendergast,,,,,,,,,,
Lukasz,Old,Student Loan Hero (now part of LendingTree),studentloanhero,twitter.com/,,11-50,Help 44 million Americans manage and repay over $1.4 trillion in student loan,studentloanhero.com,"Austin, TX",USA,Doug Lebda,,,https://studentloanhero.com/careers/?gh_jid=784488,,,,,,,
Legacy,Old,"Sucuri, Inc",sucurisecurity,twitter.com/,,5001-10000,"Website Protection, Monitoring & Remediation",https://sucuri.net/,"Menifee, CA",USA,Tony Perez,perezbox,twitter.com/,https://sucuri.net/company/employment/,,,,,,,
Legacy,Old,SugarCRM,SugarCRM,twitter.com/,,501-1000,Customer Relationship Management Tool,http://www.sugarcrm.com/,"Cupertino, CA",USA,Craig Charlton,lmaugustin,twitter.com/,http://www.sugarcrm.com/about/careers,,,,,,,
MeteorJob,Old,Sulvo,sulvox,twitter.com/,,11-50,"Higher revenue, deeper insights.",https://sulvo.com/,"Austin, TX",USA,Romeo Ju,,,sulvo.com,,,,,,,
,New,Superformula,,,,11-50,A modern digital product studio,https://superformula.com/,"Seattle, WA",USA,"Jordan Ford
",,,,,,,,,,
remoteok,Old,Surevine,surevine,twitter.com/,,11-50,Secure Collaboration Solutions,https://www.surevine.com/jobs/,Guildford,UK,Stuart Murdoch,,,https://www.surevine.com/jobs/,,,,,,,
WWR,Old,SurveyMonkey,SurveyMonkey,twitter.com/,,501-1000,Create professional surveys tailored to your needs,https://www.surveymonkey.com/mp/job-listings/,"San Mateo, CA",USA,Zander Lurie,,,https://www.surveymonkey.com/mp/jobs/,,,,,,,
,New,Suse,,,,1001-5000,Delivers smarter Linux and cloud innovation ,https://www.suse.com,Nürnberg,Germany,Melissa Di Donato,,,,,,,,,,
Legacy,Old,Swappa,swappa,twitter.com/,,11-50,Marketplace for used mobile devices.,https://swappa.com/,"Kansas City, Mo",USA,Ben Edwards,BennyBeta,twitter.com/,http://www.indeed.com/cmp/Swappa-LLC/jobs,,,,,,,
,New,Sweet Studio,,,,1-10,Venture studio in Stockholm backed by the founders of KING,https://www.sweet.studio/,Stockholm,Sweden,Anders Frostenson,,,,,,,,,,
Lukasz,Old,Sysdig Cloud,sysdig,twitter.com/,,201-500,"The first unified approach to container security, monitoring and forensics.",https://sysdig.com/jobs/,"San Francisco, CA",USA,Suresh Vasudevan,,,https://sysdig.com/jobs/,,,,,,,
Legacy,Old,Taiga.io,taigaio,twitter.com/,,11-50,Project Management + Task Based marketplace,https://taiga.io/,Madrid,Spain,Pablo Ruiz Múzquiz,diacritica,twitter.com/,,,,,,,,
Legacy,Old,Task Analytics,taskanalytics,twitter.com/,,11-50,Business intelligence and CX tooling,https://taskanalytics.com/,NY,USA,Raymond Julin,nervetattoo,twitter.com/,https://angel.co/task-analytics,,,,,,,
,,Taxes for Expats,,,,11-50,Tax Preparation for U.S. Citizens Living Abroad,https://www.taxesforexpats.com/,NY,USA,Huntly Mayo-Malasky,,,,,,,,,,
,Old,Taxjar,,,,51-200,"Making sales tax compliance simple for more than 10,000 online businesses & developers",TaxJar.com,"Boston, MA",USA,Mark Faggiano,,,,,,,,,,
Legacy,Old,TeachBoost,TeachBoost,twitter.com/,,11-50,TeachBoost is a feedback platform for K12.,https://teachboost.com,"New York, NY",USA,Jason DeRoner,jderoner,twitter.com/,https://teachboost.com/company/careers,,,,,,,
Legacy,Old,Team App,teamapp,twitter.com/,,11-50,Smartphone app for sports team communication.,http://teamapp.com/,Melbourne,Australia,Phil Warren,philwarren10,twitter.com/,https://www.teamapp.com/jobs,,,,,,,
Lukasz,Old,TeamSnap,teamsnap,twitter.com/,,51-200,online sports team management software,https://www.teamsnap.com/about/careers,"Boulder, CO",USA,David DuPont ,,,https://www.teamsnap.com/about/team-players/david-dupont,,,,,,,
Legacy,Old,TechnologyAdvice,Technology_Adv,twitter.com/,,51-200,Connects buyers and sellers of technology,http://www.technologyadvice.com/,"Nashville, TN",USA,"Rob Bellenfant
",michaeljohara,twitter.com/,http://technologyadvice.com/careers/,,,,,,,
Legacy,Old,TED,TEDTalks,twitter.com/,,51-200,Nonprofit devoted to Ideas Worth Spreading,https://www.ted.com/,"New York, NY ",USA,Chris Anderson,TEDchris,twitter.com/,http://www.ted.com/about/our-organization/jobs-at-ted,,,,,,,
,New,TelemetryTV,,,,11-50,Advanced digital signage platform,https://www.telemetrytv.com/,Vancouver,Canada,Peter Fahlman,,,,,,,,,,
,New,Teltech,,,,51-200,Innovative communications apps since 2007.,https://teltech.co/,"South Amboy, NJ",USA,Patrick Falzon,,,,,,,,,,
,New,TEN7,,,,11-50,Creating and caring for Drupal-powered websites.,https://ten7.com/,"Minneapolis, MN",USA,Ivan Stegic,,,,,,,,,,
remoteok,Old,Tenable,tenablesecurity,twitter.com/,,1001-5000,Cyber Exposure Platform,https://careers.tenable.com/jobs/search,"Columbia, MD",USA,Amit Yoran,,,https://www.tenable.com/about-tenable/leadership,,,,,,,
Legacy,Old,TEONITE,teonite,twitter.com/,,11-50,"Corporate finance, billing systems, workflow, sales support, logistics and distribution.",http://teonite.com/,Szczecin,Poland,Robert Olejnik,RobertOlejnik,twitter.com/,,,,,,,,
Lukasz,Old,Tesera,N/A,twitter.com/,,11-50,We ignite change in the future we share.,https://tesera.com/team/,Calgary,Canada,Bruce MacArthur,,,https://tesera.com/team/,,,,,,,
Legacy,Old,Tessitura Network,TessNetwork,twitter.com/,,201-500,The community and learning website for the members of the Tessitura Network,www.tessituranetwork.com/,"Dallas, TX",USA,Andrew Recinos,,,http://www.tessituranetwork.com/en/Opportunities/Careers.aspx,,,,,,,
Legacy,Old,TestDome,testdome,twitter.com/,,11-50,TestDome sells online recruitment tests.,https://www.testdome.com/,London,UK,Mario Zivic,mariozivic,twitter.com/,https://angel.co/testdome/jobs,,,,,,,
Legacy,Old,Testlio,testlio,twitter.com/,,51-200,A test case management service,https://testlio.com/,"San Francisco, CA",USA,"Steve Semelsberger
",kristelviidik,twitter.com/,https://testlio.com/jobs,,,,,,,
