,,"From Remotive.com 
with ♥",,,,,https://remotive.com/join,💼 🏠🤗💻,,   ,,,,,,,,,,,
Legacy,Old,Clustree,clustree,twitter.com/,,11-50,The Talent Management Intelligence Solution,https://www.clustree.com/,Paris,France,Bénédicte de Raphélis Soissan,benedictedrs,twitter.com/,https://www.clustree.com/careers,,,,,,,
Legacy,Old,Codeable,codeablehq,twitter.com/,,11-50,An online outsourcing service for WordPress,https://codeable.io/,Copenhagen,Denmark,Per Esbensen,per_esbensen,twitter.com/,https://remoteok.io/remote-startups/codeable,,,,,,,
Legacy,Old,Codebusters,CodebustersInc,twitter.com/,,201-500,"Helps hospitals and providers get the people they need to capture, code, and bill for their health information.",http://www.codebusters.com/,"Culver City, California ",USA,Vincent Kobayashi,,,http://codebusters.applytojob.com/apply,,,,,,,
Legacy,Old,CodeControl,CodeControl_,twitter.com/,,11-50,"CodeControl works with the top developers, designers and project managers in Europe.",https://codecontrol.io,Berlin,Germany,Marc Philipp Clemens,,,https://codecontrol.io/join-us,,,,,,,
Legacy,Old,Codeship (acquired by Cloudbees),codeship,twitter.com/,,11-50,Codeship is a hosted Continuous Delivery platform.,https://codeship.com/,Vienna,Austria,Moritz Plassnig,moritzplassnig,twitter.com/,https://codeship.com/jobs,,,,,,,
Legacy,Old,Cofense,PhishMe,twitter.com/,,501-1000,Security Behavior Management,cofense.com,"Leesburg, VA",USA,Rohyt Belani,rohytbelani,twitter.com/,http://phishme.com/company/careers/,,,,,,,
Legacy,Old,Cohesive Networks,cohesiveft,twitter.com/,,11-50,Software Defined Networking Security,http://cohesive.net,"Chicago, IL",USA,Patrick Kerpan,pjktech,twitter.com/,https://cohesive.net/about/careers,,,,,,,
Legacy,Old,Coinbase,coinbase,twitter.com/,,201-500,Buy and sell digital currency,https://www.coinbase.com,"San Francisco, CA",USA,Brian Armstrong,brian_armstrong,twitter.com/,https://www.coinbase.com/careers,,,,,,,
Legacy,Old,Collab. Drug Discovery,CDDVault,twitter.com/,,11-50,Modern Drug Discovery Informatics,http://www.collaborativedrug.com,Burlingame CA,USA,Barry A. Bunin,barrybunin,twitter.com/,https://www.collaborativedrug.com/pages/employment,,,,,,,
Legacy,Old,CollabNet,CollabNet,twitter.com/,,201-500,CollabNet is a developer of software development and application lifecycle management tools ,http://www.collab.net/,"Alpharetta, Georgia",USA,Flint Brenton ,Flint_Brenton,twitter.com/,http://www.collab.net/company/careers,,,,,,,
Legacy,Old,Collabora ,CollaboraLtd,twitter.com/,,51-200,Collabora - - Open source software-based consulting.,https://www.collabora.com/,Cambridge,UK,Philippe Kalaf,philippe_kalaf,twitter.com/,https://www.collabora.com/about-us/careers.html,,,,,,,
Legacy,Old,Collage.com,collagedotcom,twitter.com/,,51-200,"Easy-to-use software tools, which make creating custom products easy for everyone. ",https://www.collage.com/,"Brighton, MI",USA,"Joe Golden/Kevin Borders
",,,http://jobs.collage.com/,,,,,,,
,New,Comcate Software,,,,11-50,Empowering Communities and Citizens through Technology,http://www.comcate.com/,"Oakland, CA",USA,David Richmond,,,,,,,,,,
,New,Comet,,,,51-200,Platform that connects Freelancers to tech & data projects,https://comet.co/,Paris,France,Charles Thomas,,,,,,,,,,
,New,ComplianceMate,,,,11-50,PaaS building the digital food safety platform of tomorrow,https://compliancemate.com/,"Lawrenceville, GA",USA,Steven Getraer,,,,,,,,,,
StackO Jobs,Old,CompuCorp,teamcompucorp,twitter.com/,,11-50,"Web design, app development and branding for Charities and non-profit organisations",https://www.compucorp.co.uk/jobs,London,UK,Jamie Novick,,,https://www.compucorp.co.uk/jobs,,,,,,,
WWR,Old,Conferize,Conferize,twitter.com/,,11-50,The universal event solution,https://www.conferize.com/about,Copenhagen,Denmark,Steen Tromholt,,,https://www.conferize.com/jobs,,,,,,,
,New,Conjura,,,,11-50,Customer analytics,https://conjura.com/,London,UK,Fran Quilty,,,,,,,,,,
,Old,ConnectCPA,,,,11-50,Cloud accounting firm working with startups and tech companies,http://www.connectcpa.ca,Toronto,Canada,Lior Zehtser & Mike Pinkus,,,,,,,,,,
Legacy,Old,Continu,continu,twitter.com/,,51-200,Continu is beautifully simple Learning Software built for the modern workplace,www.continu.co,"San Francisco, CA",USA,Scott Burgess,,,,,,,,,,
,Old,Continued,,,,51-200,Provide an unparalleled online learning experience ,https://www.continued.com,"Houston, TX",USA,Tony Perlak,,,,,,,,,,
,Old,Contrast Security,,,,201-500,Automatically detects and fixes vulnerabilities,https://www.contrastsecurity.com/,"Los Altos, CA",USA,Alan P. Naumann,,,,,,,,,,
WWR,Old,ConvertKit LLC,convertkit,twitter.com/,,11-50,Make email easier and more robust for professional bloggers ,https://convertkit.com/about/,"Boise, ID",USA,Nathan Barry,,,https://convertkit.workable.com,,,,,,,
Legacy,Old,Conveyal,conveyal,twitter.com/,,1-10,"Analyze, manage, & understand transport data",http://conveyal.com/,"Watertown, MA",USA,Andrew Byrd,martarider,twitter.com/,http://conveyal.com/jobs/,,,,,,,
Legacy,Old,Copass,WeCopass,twitter.com/,,1-10,500+ unique workspaces. One pass.,https://copass.org/,Paris,France,Stefano Borghi,stefano_borghi,twitter.com/,https://copass.org/jobs,,,,,,,
Legacy,Old,Copyblogger,copyblogger,twitter.com/,,1-10,We Power Websites That Work,www.copyblogger.com,"Boulder, CO",USA,Brian Clark,brianclark,twitter.com/,,,,,,,,
StackO Jobs,Old,CoreData,N/A,twitter.com/,,11-50,Data made easy,https://coredata.eu/index.html,Nicosia,Cyprus,Kunal Kapur,,,https://coredata.eu/careers.html,,,,,,,
Legacy,Old,Corgibytes,corgibytes,twitter.com/,,11-50,We love maintaining and improving existing code.,http://corgibytes.com/,"Richmond, VA",USA,Andrea Goulet,andreagoulet,twitter.com/,http://corgibytes.com/careers/,,,,,,,
,new,Cornis,,,,11-50,Automating wind turbines inspections,https://home.cornis.fr/,Paris,France,"Thibault Gouache
",,,,,,,,,,
Legacy,Old,Countly,gocountly,twitter.com/,,11-50,Mobile and web analytics & marketing platform,https://count.ly/,London,UK,Onur Alp Soner,oasoner,twitter.com/,https://angel.co/countly/jobs,,,,,,,
,New,Course Concierge,,,,11-50,We develop online courses for NYT best-selling authors,https://courseconcierge.com/,"Los Angeles, CA",USA,Till H. Gross,,,,,,,,,,
Legacy,Old,Covenant Eyes,covenanteyes,twitter.com/,,51-200,Internet filtering and accountability,http://www.covenanteyes.com/,"Owosso, MI",USA,Ron DeHaas,,,http://www.covenanteyes.com/about-covenant-eyes/careers/,,,,,,,
,Old,CoverMyMeds,,,,"1,001-5,000",Helping patients get the medication they need to live healthy lives,https://www.covermymeds.com/,"Colombus, OH",USA,David Holladay,,,,,,,,,,
Legacy,Old,Cozy Cloud,MyCozyCloud,twitter.com/,,11-50,A personal cloud for everyone!,https://cozy.io,Paris,France,Benjamin André,,,https://angel.co/cozycloud,,,,,,,
,,CrewBloom,,,,51-200,Connecting the top 2% of global talent to remote jobs they love.,https://crewbloom.com/,New York,USA,Kate Ringcodan & Brianna Carney,,,,,,,,,,
Legacy,Old,CROmetrics,crometrics,twitter.com/,,11-50,We help companies grow through data-driven experimentation.,http://www.crometrics.com/,"Kentfield, CA",USA,Chris Neumann ,cyclin,twitter.com/,,,,,,,,
Lukasz,Old,Crossover,Crossover4Work,twitter.com/,,"1,001-5,000",Crossover teams deliver a 50% improvement at a 50% cost reduction ,https://www.crossover.com/#index,"Austin, TX",USA,Patrice Marsille-Franey,,,https://www.crossover.com/#index,,,,,,,
Legacy,Old,Crowdstrke,crowdstrike,twitter.com/,,"1,001-5,000",Cloud-Delivered Next-Gen Endpoint Protection,https://www.crowdstrike.com/,"Sunnyvale, CA",USA,George Kurtz,George_Kurtz,twitter.com/,https://www.crowdstrike.com/careers/,,,,,,,
,Old,Custody x Change,,,,11-50,Tool for Parenting Scheduling,https://www.custodyxchange.com/,Salt Lake City,USA,Ben Coltrin,,,,,,,,,,
,New,Cvedia,,,,11-50,Simulator for machine learning,https://cvedia.com,"Arlington, VA",USA,Arjan Wijnveen,,,,,,,,,,
Legacy,Old,Cyanna Education,cyannaes,twitter.com/,,11-50,Higher education software,https://cyanna.com,Columbus OH,USA,Chris Eckels,chriscyanna,twitter.com/,https://cyanna.com/careers/,,,,,,,
,New,Daocloud,,,,1-10,Community of wellness enthusiasts and professionals. ,https://www.daocloud.com/,"San Francisco, CA",USA,Max Coleman,,,,,,,,,,
StackO Jobs,Old,DataCite ,datacite,twitter.com/,,1-10,"Locate, identify, and cite research data",https://www.datacite.org/,Hannover,Germany,Matthew Buys,,,https://www.datacite.org/jobopportunities.html,,,,,,,
Lukasz,Old,Datadog,datadoghq,twitter.com/,,"1,001-5,000",Easy to use and scalable monitoring systems,https://www.datadoghq.com/jobs-engineering/,"New York, NY ",USA,Olivier Pomel,,,,,,,,,,
WWR,Old,Dataquest,ataquestio,twitter.com/,,11-50,We're re-inventing online learning,https://www.dataquest.io/about-us,"San Francisco, CA",USA,Vik Paruchuri,,,https://dataquest.breezy.hr/,,,,,,,
Legacy,Old,DataStax,DataStax,twitter.com/,,201-500,DataStax does Operational Database Management Systems.,http://www.datastax.com,"Santa Clara, CA",USA,Chet Kapoor,billy_bosworth,twitter.com/,http://www.datastax.com/company/careers/search,,,,,,,
,New,DBNY,,,,11-50 ,eCommerce consultancy for direct to consumer and B2B brands.,http://dbny.co/,"New York, NY ",USA,Amlan Das ,,,,,,,,,,
,New,DCD Automotive Holdings,,,,"1,001-5,000",DCD Automotive is all about making customers happy,http://dcd.auto/,"Norwood, MA",USA,Daniel Dagesse,,,,,,,,,,
Legacy,Old,DealDash,DealDash,twitter.com/,,51-200,DealDash is an e-commerce company operating a pay-to-participate auction website,https://www.dealdash.com/,"Minneapolis, MN",USA,Pasi Lohi,williamwolfram,twitter.com/,https://dealdash.workable.com/,,,,,,,
remoteok,Old,Dealer Inspire,DealerInspire,twitter.com/,,201-500,building unprecedented websites and technology to help dealerships sell more,https://www.dealerinspire.com/careers/,"Naperville, IL",USA,Joe Chura,,,https://www.dealerinspire.com/careers/,,,,,,,
Lukasz,Old,Deeson,DeesonAgency,twitter.com/,,11-50,"Digital agency specialising in Drupal, Symfony and Laravel",https://www.deeson.co.uk/about,"Canterbury, Kent",UK,Tim Deeson,,,https://www.deeson.co.uk/about,,,,,,,
,New,Delicious Brains,,,,1-10,We make super awesome plugins for WordPress.,https://deliciousbrains.com/,"Truro, Nova Scotia",Canada,Brad Touesnard,,,,,,,,,,
,Old,Delphia,,,,11-50,"Invest with your data, not your money",https://delphia.com,Toronto,Canada,Andrew Peek,,,,,,,,,,
Lukasz,Old,Demio,meetdemio,twitter.com/,,1-10,Webinar platform that just works.,https://demio.com/compare-demio,"Tampa, FL",USA,David Abrams,,,https://demio.com/compare-demio,,,,,,,
AL,Old,DesignLab,trydesignlab,twitter.com/,,11-50,Training the world's creative talent ,http://trydesignlab.com/about/,"San Francisco, CA",USA,Harish Venkatesan,,,https://angel.co/designlab/jobs,,,,,,,
Legacy,Old,Dgraph,dgraphlabs,twitter.com/,,11-50,"Scalable, Distributed, Low Latency Graph Database",https://dgraph.io/,"San Francisco, CA",USA,Manish Jain,manishrjain,twitter.com/,https://dgraph.io/careers.html,,,,,,,
Legacy,Old,Digital Ocean,digitalocean,twitter.com/,,501-1000,"Simple Cloud Hosting, Built for Developers.",http://www.digitalocean.com,"New York, NY",USA,Ben Uretsky,benuretsky,twitter.com/,https://www.digitalocean.com/company/careers/,,,,,,,
,Old,digitalis.io,,,,11-50,Supporting Data driven entreprises,https://digitalis.io/,London,UK,Hayato Shimizu,,,,,,,,,,
StackO Jobs,Old,Dimanex,DiManEx_BV,twitter.com/,,11-50,Supply any part anywhere,https://www.dimanex.com/,Utrecht,Netherlands,Tibor van Melsem Kocsis,,,https://www.dimanex.com/,,,,,,,
Legacy,Old,Dito,DitoWeb,twitter.com/,,11-50,Dito is one of the original 30 hand-picked Google Apps Authorized Resellers.,http://www.ditoweb.com,"Reston, VA",USA,Dan McNelis,Dan_VT,twitter.com/,http://www.ditoweb.com/company/employment/,,,,,,,
remoteok,Old,Divio,divio,twitter.com/,,11-50,We serve django CMS,https://www.divio.com/en/company/about/,Stockholm,Sweden,Jon Levin,,,https://www.divio.com/en/company/about/,,,,,,,
Legacy,Old,DNSimple,dnsimple,twitter.com/,,11-50,Domain name services for developers,https://dnsimple.com,"Melbourne, FL",USA,Anthony Eden,aeden,twitter.com/,,,,,,,,
Legacy,Old,Docker,docker,twitter.com/,,51-200,An open platform for distributed applications for developers and sysadmins,http://www.docker.com,"San Francisco, CA",USA,Scott Johnston,golubbe,twitter.com/,https://www.docker.com/careers,,,,,,,
Legacy,Old,doctorSIM,doctorsim,twitter.com/,,11-50,Phone Unlock. Phone Checks. Operator Switch.,https://www.doctorsim.com/,Madrid,Spain,Hugo Meana,globile,twitter.com/,https://www.doctorsim.com/gb-en/jobs.html,,,,,,,
Legacy,Old,Doist,todoist,twitter.com/,,51-200,"At Doist, we specialize in productivity software",doist.com,"North Pole, AK",USA,Amir Salihefendic,amix3k,twitter.com/,https://doist.com/jobs/,,,,,,,
Legacy,Old,Domino Data Lab,DominoDataLab,twitter.com/,,51-200,Tools for data science teams.,https://www.dominodatalab.com/,"San Francisco, CA",USA,Nick Elprin,,,https://www.dominodatalab.com/careers,,,,,,,
MeteorJob,Old,doopoll,doopoll,twitter.com/,,1-10,"Create powerful, yet simple polls",https://doopoll.co/,Cardiff,UK,Marc Thomas,,,https://doopoll.co/jobs/,,,,,,,
Lukasz,Old,Dotsub,dotsub,twitter.com/,,11-50,The leading source for video translation and captions,https://dotsub.com/jobs,"New York, NY",USA,Michael Smolens,,,,,,,,,,
Legacy,Old,Doximity,doximity,twitter.com/,,201-500,Largest online medical network of physicians.,https://www.doximity.com,"San Francisco, CA",USA,Jeff Tangney,jefftangney,twitter.com/,https://www.doximity.com/about/jobs,,,,,,,
,,Doyensec,,,,11-50,Security engineering at work,https://doyensec.com/,"San Francisco, CA",USA,Luca Carettoni,,,,,,,,,,
Legacy,Old,DRONAMICS,dronamics,twitter.com/,,1-10,We Build CARGO DRONES,http://www.dronamics.com/,Sofia,Bulgaria,Svilen Rangelov,,,,,,,,,,
Legacy,Old,DroneDeploy,DroneDeploy,twitter.com/,,51-200,"DroneDeploy is apowerful, cloud-based drone mapping and analytics platform",https://www.dronedeploy.com/,"San Francisco, CA",USA,Mike Winn,mikewinn,twitter.com/,https://angel.co/dronedeploy/jobs,,,,,,,
Legacy,Old,Duck Duck Go,duckduckgo,twitter.com/,,51-200,The search engine that doesn't track you.,https://duckduckgo.com/,"Paoli, PA",USA,Gabriel Weinberg,yegg,twitter.com/,https://duck.co/help/company/hiring,,,,,,,
Legacy,Old,Eaternity,eaternity,twitter.com/,,1-10,We calculate CO2 for meals and restaurants.,http://www.eaternity.org/,Zurich,Switzerland,Manuel Klarmann,mklarmann,twitter.com/,,,,,,,,
,New,Ebury,,,,501-1000,Financial solutions to grow your business,http://www.ebury.com/,London,UK,Salvador Garcia,,,,,,,,,,
Legacy,Old,Edify,3d1fy,twitter.com/,,11-50,"Edify creates creative, performance-based, custom e-learning solutions ",http://www.edify.cr/,Alajuela,Costa Rica,Federico Hess,,,http://www.edify.cr/joinus,,,,,,,
remoteok,Old,Edison Nation,EdisonNation,twitter.com/,,11-50,We turn our users' product ideas into real-world products on store shelves.,https://edisonnation.com/,"Bethlehem, PA",USA,Louis Foreman,,,https://stackoverflow.com/jobs/companies/edison-nation,,,,,,,
Legacy,Old,Eet.nu,eetnu,twitter.com/,,11-50,Restaurant guide with tools for restaurants.,https://www.eet.nu/,Sittard,Netherlands,Jeroen Wubbe,,,,,,,,,,
remoteok,Old,Eezy,eezy,twitter.com/,,11-50,Content for Creative Minds,http://www.eezy.com/#team-block,"Bowling Green, KY",USA,Shawn Rubel,,,http://www.eezy.com/,,,,,,,
Legacy,Old,Elastic,elasticsearch,twitter.com/,,"1,001-5,000",Search & Analyze Data in Real Time,https://www.elastic.co/,"Mountain View, CA ",USA,Shay Banon,stevenschuurman,twitter.com/,https://www.elastic.co/about/careers,,,,,,,
Legacy,Old,ElevenYellow,elevenyellow,twitter.com/,,1-10,We invest technology and time in different projects,http://www.elevenyellow.com,Indonesia,Indonesia,José Sáez López,jsaez,twitter.com/,x,,,,,,,
Legacy,Old,EngageTech,AlchemyTecLtd,twitter.com/,,51-200 ,"Makes it easy for businesses to find, hire and pay temporary workers ",https://engagetech.com,London,UK,"Howard Hughes
",,,https://engagetech.workable.com/,,,,,,,
WWR,Old,Enjin,enjin,twitter.com/,,11-50,Smart cryptocurrency for gaming,https://enjincoin.io/,Singapore,Singapore,Maxim Blagov,,,https://enjincoin.io/,,,,,,,
Legacy,Old,Envato,envato,twitter.com/,,"501-1,000",We help marketers build landing page,https://envato.com/,Melbourne,Australia,"Hichame Assi
",cyantaeed,twitter.com/,http://careers.envato.com/,,,,,,,
Legacy,Old,Etsy,Etsy,twitter.com/,,501-1000,the world's most vibrant handmade marketplace,https://www.etsy.com/,"Brooklyn, NY",USA,Josh Silverman,chaddickerson,twitter.com/,https://www.etsy.com/careers/?ref=ftr,,,,,,,
,,Evergiving,,,,11-50,Software for charities that acquire and manage regular donors,https://www.evergiving.com/,Sydney,Australia,James Goodridge,,,,,,,,,,
WWR,Old,EveryoneSocial,EveryoneSocial,twitter.com/,,11-50,Social Selling & Employee Advocacy,https://everyonesocial.com/resources/,"Salt Lake City, UT",USA,Cameron Brain,,,https://everyonesocial.com/,,,,,,,
,,ExecVision,,,,11-50,AI assisted coaching - enhancing human coaches with AI analysis,https://www.execvision.io/,"Arlington, VA",USA,David Stillman,,,,,,,,,,
,New,Explainify,,,,11-50,We get inside your buyer’s mind to explain what you do and why people should care.,http://explainify.com/,"Fayetville, AR",USA,Eric Hinson,,,,,,,,,,
Legacy,Old,Exposure Ninja,ExposureNinja,twitter.com/,,51-200,"Digital Marketing Agency for SEO, PPC, and Digital PR",https://www.exposureninja.com/,Nottingham,UK,Tim Cameron-Kitchen,timninjakitchen,twitter.com/,https://www.exposureninja.com/working-with-exposure-ninja/,,,,,,,
Legacy,Old,Eyeo,eyeo,twitter.com/,,51-200,We develop open source software that millions of people use every day ,https://eyeo.com,Koln,Germany,Till Faida,,,https://eyeo.com/en/jobs/,,,,,,,
,New,Fanatical Labs,,,,1-10,We help companies get stuff done faster by connecting their internal systems.,https://fanaticallabs.com/,"Minneapolis, MN",USA,Jason Eggers,,,,,,,,,,
,New,Farmstead,,,,11-50,Make high quality food accessible to everyone,http://www.farmsteadapp.com/,"San Francisco, CA",USA,Pradeep Elankumaran,,,,,,,,,,
Legacy,Old,Fastly,fastly,twitter.com/,,"501-1,000",Fastly is the future of content delivery.,https://www.fastly.com/,"San Francisco, CA",USA,Joshua Bixby,crucially,twitter.com/,https://www.fastly.com/about/careers,,,,,,,
Legacy,Old,Fatura Simples,faturasimples,twitter.com/,,11-50,Recurring Billing | Accounting and Subscription,https://www.faturasimples.com.br/,Recife,Brazil,Felipe Bagetti,,,https://angel.co/fatura-simples/jobs,,,,,,,
Legacy,Old,Feeld,feeldCo,twitter.com/,,11-50,Celebrating openminded humans.   ,https://feeld.co/,London,UK,Dimo Trifonov,denull,twitter.com/,https://feeld.co/jobs,,,,,,,
,New,Figma,,,,51-200,Collaborative design tool enabling companies to create beautiful software,http://www.figma.com/,"San Francisco, CA",USA,Dylan Field,,,,,,,,,,
StackO Jobs,Old,Findify,getfindify,twitter.com/,,11-50,Real-Time Personalized Search,https://www.findify.io/,Stockholm,Sweden,"Philip Nobel
",,,https://findify.io/careers/,,,,,,,
,Old,FineTune learning,,,,51-200,"Assessing, Evaluating, and Strengthening Complex Skills.",https://www.finetunelearning.com/,"Boston, MA",USA,Steve Shapiro,,,,,,,,,,
Legacy,Old,Fire Engine RED,185red,twitter.com/,,51-200,"Innovative marketing, technology, and data solutions for the education market.",http://fire-engine-red.com/,US,USA,Shelly Spiegel,,,http://fire-engine-red.com/about/#careers,,,,,,,
,New,First+Third,,,,11-50,Custom websites tailored to your business,https://firstandthird.com/,"Hermosa Beach, CA",USA,Greg Allen,,,,,,,,,,
Legacy,Old,Five Q,fiveq,twitter.com/,,11-50,Five Q is an interactive web development and marketing agency ,https://www.fiveq.com/,"Atlantic, IA ",USA,Chad Williams,chadw5Q,twitter.com/,https://www.fiveq.com/careers/,,,,,,,
Legacy,Old,Fleep,fleepio,twitter.com/,,11-50,Fleep is a secure messenger app that works with email. ,https://fleep.io,Tallin,Estonia,"Asko Oja
",hennruukel,twitter.com/,angle,,,,,,,
WWR,Old,Fleetio,fleetio,twitter.com/,,51-200,"Track, analyze and improve your fleet operations",https://www.fleetio.com/careers,"Birmingham, AL",USA,Tony Summerville,,,https://www.fleetio.com/careers,,,,,,,
Legacy,Old,Flockler,getflockler,twitter.com/,,11-50,"With Flockler you can easily combine editorial, curated and social content",http://flockler.com/,London,UK,Toni Hopponen,tonihopponen,twitter.com/,angel list,,,,,,,
Legacy,Old,Flow,flowapp,twitter.com/,,11-50,Flow is project management software that simplifies teamwork.,https://www.getflow.com,British Columbia,Canada,Andrew Wilkinson,awilkinson,twitter.com/,angel list,,,,,,,
,New,Flyreel,,,,11-50,AI & Computer Vision Startup for Home Inspections,http://flyreel.com/,"Denver, CO",USA,Cole Winans,,,,,,,,,,
,,"From Remotive.com 
with ♥",,,,,https://remotive.com/join,💼 🏠🤗💻,,💼 🏠🤗💻,,   ,,,,,"Missing your company?
Hiring remotely?
Email me at 
hello@remotive.io",,,,
Legacy,Old,Focus Asia,focusasiatravel,twitter.com/,,201-500 ,Focus Asia,http://focus.asia/,Ho Chi Minh City,Vietnam,Guy Dusselier,,,http://focus.asia/careers/,,,,,,,
Legacy,Old,Folarium Technomedia,folariumtech,twitter.com/,,11-50,Software Integrated Development,http://www.folarium.co.id/,Yogyakarta,Indonesia,Fachrur Rois H,,,http://www.folarium.co.id/career,,,,,,,
Legacy,Old,Follow Up Boss,followupboss,twitter.com/,,11-50,Real Estate Sales CRM,http://www.followupboss.com,"San Francisco, CA",USA,Dan Corkill,buzzdan,twitter.com/,https://boards.greenhouse.io/followupboss#.WAZIKxB96b_,,,,,,,
Legacy,Old,Fonoma,FonomaCuba,twitter.com/,,11-50,International Bill Payments platform,https://www.fonoma.com/,"Henderson, Nevada ",USA,Hiram Centelles,hcentelles,twitter.com/,,,,,,,,
Legacy,Old,Forest Admin,forestsaas,twitter.com/,,11-50,The Admin Interface your application deserves,http://www.forestadmin.com,Paris,France,Sandro Munda,seyz_,twitter.com/,https://forestadmin.workable.com/,,,,,,,
,New,Forget The Funnel,,,,1-10,Elevate those who are underestimated at tech companies.,https://forgetthefunnel.com/,Montreal,Canada,Georgiana Laudi,,,,,,,,,,
Legacy,Old,FormAssembly,formassembly,twitter.com/,,51-200,We specialize in web forms and data collection,https://www.formassembly.com/,"Bloomington, IN",USA,Cedric Savarese,,,https://formassembly.workable.com/,,,,,,,
Legacy,Old,Formstack,Formstack,twitter.com/,,51-200,An online form building application to create & design any type of HTML web form.,https://www.formstack.com/,"Fishers, IN",USA,Chris Byers,rchrisbyers,twitter.com/,https://www.formstack.com/careers,,,,,,,
Legacy,Old,Fortumo,fortumo,twitter.com/,,51-200,"Direct carrier billing in 92 countries for apps, games, digital media companies...",https://fortumo.com/,Tartu,Estonia,Martin Koppel,martinkoppel,twitter.com/,https://careers.fortumo.com/,,,,,,,
WWR,Old,Forward Financing,fwd_financing,twitter.com/,,51-200,Finance + Technology for SMB,https://www.forwardfinancing.com/,"Boston, MA",USA,Justin Bakes,,,www.forwardfinancing.com,,,,,,,
Legacy,Old,Foundersuite.com,Foundersuite,twitter.com/,,11-50,CRM for startups raising capital,https://foundersuite.com/,"San Francisco, CA",USA,Nathan Beckord,sailornathan,twitter.com/,https://foundersuite.com/jobs,,,,,,,
WWR,Old,Foundr Magazine,foundr,twitter.com/,,11-50,"digital resource for the growing ranks of craft, self-made entrepreneurs",https://foundr.com/about-us/,Melbourne,Australia,Nathan Chan ,,,https://foundr.com/careers/content-marketer/,,,,,,,
Legacy,Old,Four Kitchens,fourkitchens,twitter.com/,,11-50,We make BIG websites using open-source technology and user-centered design.,https://www.fourkitchens.com,"Austin, TX",USA,Todd Ross Nienkerk,toddross,twitter.com/,https://www.fourkitchens.com/careers/,,,,,,,
Legacy,Old,fournova,fournova,twitter.com/,,1-10,Developing apps and tools for developers,https://www.fournova.com/,Stuttgart,Germany,Tobias Günther,gntr,twitter.com/,https://www.fournova.com/jobs,,,,,,,
WWR,Old,FoxAndSheep,_foxandsheep,twitter.com/,,1-10,Developing an exciting new camera app called Chomp,http://www.foxandsheep.com/team/,Berlin,Germany,Timo Dries ,,,https://chomp.workable.com/,,,,,,,
Legacy,Old,Foxio,foxiosays,twitter.com/,,1-10,We partner with entrepreneurs to craft experience-focused web products that are a joy to use.,http://fox.io/,"Indianapolis, IN",USA,Peter Lockhart,thisispeter,twitter.com/,http://fox.io/jobs/,,,,,,,
,Old,Frontastic GmbH,,,,11-50,Composable Frontend Platform,https://www.frontastic.cloud/,Münster,Germany,Thomas Gottheil,,,,,,,,,,
Legacy,Old,FRSH,frshonline,twitter.com/,,1-10,Subscription based healthy meal plan delivery,http://www.frsh.com/#/,Gurgaon,India,Badal Goel,badalgoel2,twitter.com/,,,,,,,,
Legacy,Old,Fuel Made,fuelmade,twitter.com/,,11-50,"We build solid solutions that work across platforms, screen sizes, and browsers, and that age well. ",http://fuelmade.com/,"Colbert, WA",USA,"Carson McComas
",carson,twitter.com/,http://fuelmade.com/pages/jobs,,,,,,,
WWR,Old,FullStack,gofullstack,twitter.com/,,11-50,"modern web and mobile technologies to build software products,",http://gofullstack.com/about/,"Iowa City, IA",USA,Josh Cramer,,,http://gofullstack.com/,,,,,,,
Legacy,Old,Funding Gates,fundinggates,twitter.com/,,51-200,"Funding Gates provides credit screening, monitoring and collection tools for SMBs",https://www.fundinggates.com,"New York, NY ",USA,"Jean-Marc Freuler
",ismail_colak,twitter.com/,https://www.fundinggates.com/jobs/,,,,,,,
WWR,Old,G2i,g2i_co,twitter.com/,,11-50,React.js & React Native Development You Can Trust,https://www.g2i.co/," Delray Beach, FL",USA,Gabe Greenberg,,,https://g2i.co,,,,,,,
,New,Gatekeeper,,,,51-200,Bringing clarity to supplier and contract data,https://www.gatekeeperhq.com/,London,UK,Patrick O'Connor,,,,,,,,,,
